{
  "lessonId": "0.0.1",
  "level": 0,
  "unit": 0,
  "stage": 1,
  "title": "Lección de prueba",
  "titleEn": "Test lesson",
  "audience": ["cade", "casey"],
  "language": "es-MX",
  "exercises": [
    {
      "exerciseId": "0.0.1.1",
      "type": "listen_choose",
      "text": "La manzana.",
      "meaningEn": "The apple.",
      "choices": [
        { "image": "images/manzana.webp", "label": "apple", "correct": true },
        { "image": "images/pan.webp", "label": "bread", "correct": false },
        { "image": "images/agua.webp", "label": "water", "correct": false },
        { "image": "images/leche.webp", "label": "milk", "correct": false }
      ],
      "note": {
        "en": "Manzana is a feminine noun. Most feminine nouns use la.",
        "es": "Manzana es un sustantivo femenino. La mayoría de los sustantivos femeninos llevan el artículo la."
      }
    },
    {
      "exerciseId": "0.0.1.2",
      "type": "repeat",
      "text": "Buenos días.",
      "meaningEn": "Good morning.",
      "voice": "es-MX-JorgeNeural"
    },
    {
      "exerciseId": "0.0.1.3",
      "type": "read_aloud",
      "text": "Quiero un café, por favor.",
      "meaningEn": "I want a coffee, please.",
      "note": {
        "en": "Por favor means please.",
        "es": "Por favor sirve para pedir algo con cortesía."
      }
    },
    {
      "exerciseId": "0.0.1.4",
      "type": "listen_type",
      "text": "Gracias.",
      "meaningEn": "Thank you."
    }
  ]
}
